10.0.2.15,10.0.2.255,138,138,BROWSER,1460611590,10.0.2.255,"Domain/Workgroup Announcement WORKGROUP, NT Workstation, Domain Enum"
10.0.2.15,75.75.75.75,49953,53,DNS,1460611595,75.75.75.75,Standard query 0xd4f5 A www.djapp.info
75.75.75.75,10.0.2.15,53,49953,DNS,1460611596,10.0.2.15,Standard query response 0xd4f5 A www.djapp.info CNAME djapp.info A 52.1.45.42
10.0.2.15,52.1.45.42,49438,80,TCP,1460611596,52.1.45.42,49438  >  http [SYN] Seq=0 Win=8192 Len=0 MSS=1460 WS=256 SACK_PERM=1
52.1.45.42,10.0.2.15,80,49438,TCP,1460611596,10.0.2.15,"http  >  49438 [SYN, ACK] Seq=0 Ack=1 Win=65535 Len=0 MSS=1460"
10.0.2.15,52.1.45.42,49438,80,TCP,1460611596,52.1.45.42,49438  >  http [ACK] Seq=1 Ack=1 Win=64240 Len=0
10.0.2.15,52.1.45.42,49438,80,HTTP,1460611596,52.1.45.42,GET /?domain=ffnyRwCSeu.com&dotnet=2&file=installer&ip=52.1.45.42:80&pub_id=377&setup_id=300&srcid=UFAf_PI7Dh3IizD6k3VGXf8V7slq5pJZmGYrhLIFYhTJiUp2-KcxyCtDJmXH&dbg=1 HTTP/1.1 
52.1.45.42,10.0.2.15,80,49438,TCP,1460611596,10.0.2.15,http  >  49438 [ACK] Seq=1 Ack=309 Win=65535 Len=0
52.1.45.42,10.0.2.15,80,49438,HTTP,1460611596,10.0.2.15,HTTP/1.1 302 Moved Temporarily  (text/html) (text/html)
10.0.2.15,75.75.75.75,54194,53,DNS,1460611596,75.75.75.75,Standard query 0x59f1 A d2imjp01y2qig5.cloudfront.net
75.75.75.75,10.0.2.15,53,54194,DNS,1460611596,10.0.2.15,Standard query response 0x59f1 A d2imjp01y2qig5.cloudfront.net A 54.230.144.210 A 54.230.144.10 A 54.230.144.107 A 54.230.144.199 A 54.230.144.147 A 54.230.144.117 A 54.230.144.234 A 54.230.144.143
10.0.2.15,52.1.45.42,49438,80,TCP,1460611596,52.1.45.42,49438  >  http [ACK] Seq=309 Ack=259 Win=63982 Len=0
10.0.2.15,54.230.144.210,49439,80,TCP,1460611596,54.230.144.210,49439  >  http [SYN] Seq=0 Win=8192 Len=0 MSS=1460 WS=256 SACK_PERM=1
54.230.144.210,10.0.2.15,80,49439,TCP,1460611596,10.0.2.15,"http  >  49439 [SYN, ACK] Seq=0 Ack=1 Win=65535 Len=0 MSS=1460"
10.0.2.15,54.230.144.210,49439,80,TCP,1460611596,54.230.144.210,49439  >  http [ACK] Seq=1 Ack=1 Win=64240 Len=0
10.0.2.15,54.230.144.210,49439,80,HTTP,1460611596,54.230.144.210,GET /FinalInstaller_dotnet2.exe HTTP/1.1 
54.230.144.210,10.0.2.15,80,49439,TCP,1460611596,10.0.2.15,http  >  49439 [ACK] Seq=1 Ack=190 Win=65535 Len=0
54.230.144.210,10.0.2.15,80,49439,HTTP,1460611596,10.0.2.15,HTTP/1.1 200 OK  (application/octet-stream)
54.230.144.210,10.0.2.15,80,49439,TCP,1460611596,10.0.2.15,http  >  49439 [ACK] Seq=1421 Ack=190 Win=65535 Len=1420
10.0.2.15,54.230.144.210,49439,80,TCP,1460611596,54.230.144.210,49439  >  http [ACK] Seq=190 Ack=2841 Win=64240 Len=0
54.230.144.210,10.0.2.15,80,49439,TCP,1460611596,10.0.2.15,http  >  49439 [ACK] Seq=2841 Ack=190 Win=65535 Len=1420
54.230.144.210,10.0.2.15,80,49439,TCP,1460611596,10.0.2.15,http  >  49439 [ACK] Seq=4261 Ack=190 Win=65535 Len=1420
54.230.144.210,10.0.2.15,80,49439,TCP,1460611596,10.0.2.15,http  >  49439 [ACK] Seq=5681 Ack=190 Win=65535 Len=1420
10.0.2.15,54.230.144.210,49439,80,TCP,1460611596,54.230.144.210,49439  >  http [ACK] Seq=190 Ack=7101 Win=64240 Len=0
54.230.144.210,10.0.2.15,80,49439,TCP,1460611596,10.0.2.15,http  >  49439 [ACK] Seq=7101 Ack=190 Win=65535 Len=1420
54.230.144.210,10.0.2.15,80,49439,TCP,1460611596,10.0.2.15,http  >  49439 [ACK] Seq=8521 Ack=190 Win=65535 Len=1420
54.230.144.210,10.0.2.15,80,49439,TCP,1460611596,10.0.2.15,http  >  49439 [ACK] Seq=9941 Ack=190 Win=65535 Len=1420
54.230.144.210,10.0.2.15,80,49439,TCP,1460611596,10.0.2.15,"http  >  49439 [PSH, ACK] Seq=11361 Ack=190 Win=65535 Len=1337"
10.0.2.15,54.230.144.210,49439,80,TCP,1460611596,54.230.144.210,49439  >  http [ACK] Seq=190 Ack=12698 Win=64240 Len=0
54.230.144.210,10.0.2.15,80,49439,TCP,1460611596,10.0.2.15,"http  >  49439 [PSH, ACK] Seq=12698 Ack=190 Win=65535 Len=1360"
54.230.144.210,10.0.2.15,80,49439,TCP,1460611596,10.0.2.15,http  >  49439 [ACK] Seq=14058 Ack=190 Win=65535 Len=1420
54.230.144.210,10.0.2.15,80,49439,TCP,1460611596,10.0.2.15,http  >  49439 [ACK] Seq=15478 Ack=190 Win=65535 Len=1420
54.230.144.210,10.0.2.15,80,49439,TCP,1460611596,10.0.2.15,http  >  49439 [ACK] Seq=16898 Ack=190 Win=65535 Len=1420
54.230.144.210,10.0.2.15,80,49439,TCP,1460611596,10.0.2.15,http  >  49439 [ACK] Seq=18318 Ack=190 Win=65535 Len=1420
10.0.2.15,54.230.144.210,49439,80,TCP,1460611596,54.230.144.210,49439  >  http [ACK] Seq=190 Ack=19738 Win=64240 Len=0
54.230.144.210,10.0.2.15,80,49439,TCP,1460611596,10.0.2.15,"http  >  49439 [PSH, ACK] Seq=19738 Ack=190 Win=65535 Len=1120"
54.230.144.210,10.0.2.15,80,49439,TCP,1460611596,10.0.2.15,"http  >  49439 [PSH, ACK] Seq=20858 Ack=190 Win=65535 Len=1360"
10.0.2.15,54.230.144.210,49439,80,TCP,1460611596,54.230.144.210,49439  >  http [ACK] Seq=190 Ack=22218 Win=64240 Len=0
54.230.144.210,10.0.2.15,80,49439,TCP,1460611596,10.0.2.15,"http  >  49439 [PSH, ACK] Seq=22218 Ack=190 Win=65535 Len=1360"
54.230.144.210,10.0.2.15,80,49439,TCP,1460611596,10.0.2.15,http  >  49439 [ACK] Seq=23578 Ack=190 Win=65535 Len=1420
54.230.144.210,10.0.2.15,80,49439,TCP,1460611596,10.0.2.15,http  >  49439 [ACK] Seq=24998 Ack=190 Win=65535 Len=1420
54.230.144.210,10.0.2.15,80,49439,TCP,1460611596,10.0.2.15,http  >  49439 [ACK] Seq=26418 Ack=190 Win=65535 Len=1420
54.230.144.210,10.0.2.15,80,49439,TCP,1460611596,10.0.2.15,http  >  49439 [ACK] Seq=27838 Ack=190 Win=65535 Len=1420
54.230.144.210,10.0.2.15,80,49439,TCP,1460611596,10.0.2.15,http  >  49439 [ACK] Seq=29258 Ack=190 Win=65535 Len=1420
54.230.144.210,10.0.2.15,80,49439,TCP,1460611596,10.0.2.15,http  >  49439 [ACK] Seq=30678 Ack=190 Win=65535 Len=1420
10.0.2.15,54.230.144.210,49439,80,TCP,1460611596,54.230.144.210,49439  >  http [ACK] Seq=190 Ack=32098 Win=64240 Len=0
54.230.144.210,10.0.2.15,80,49439,TCP,1460611596,10.0.2.15,"http  >  49439 [PSH, ACK] Seq=32098 Ack=190 Win=65535 Len=1000"
54.230.144.210,10.0.2.15,80,49439,TCP,1460611597,10.0.2.15,http  >  49439 [ACK] Seq=33098 Ack=190 Win=65535 Len=1420
54.230.144.210,10.0.2.15,80,49439,TCP,1460611597,10.0.2.15,http  >  49439 [ACK] Seq=34518 Ack=190 Win=65535 Len=1420
54.230.144.210,10.0.2.15,80,49439,TCP,1460611597,10.0.2.15,http  >  49439 [ACK] Seq=35938 Ack=190 Win=65535 Len=1420
54.230.144.210,10.0.2.15,80,49439,TCP,1460611597,10.0.2.15,"http  >  49439 [PSH, ACK] Seq=37358 Ack=190 Win=65535 Len=1180"
10.0.2.15,54.230.144.210,49439,80,TCP,1460611597,54.230.144.210,49439  >  http [ACK] Seq=190 Ack=38538 Win=64240 Len=0
54.230.144.210,10.0.2.15,80,49439,TCP,1460611597,10.0.2.15,http  >  49439 [ACK] Seq=38538 Ack=190 Win=65535 Len=1420
54.230.144.210,10.0.2.15,80,49439,TCP,1460611597,10.0.2.15,http  >  49439 [ACK] Seq=39958 Ack=190 Win=65535 Len=1420
54.230.144.210,10.0.2.15,80,49439,TCP,1460611597,10.0.2.15,http  >  49439 [ACK] Seq=41378 Ack=190 Win=65535 Len=1420
54.230.144.210,10.0.2.15,80,49439,TCP,1460611597,10.0.2.15,http  >  49439 [ACK] Seq=42798 Ack=190 Win=65535 Len=1420
54.230.144.210,10.0.2.15,80,49439,TCP,1460611597,10.0.2.15,"http  >  49439 [PSH, ACK] Seq=44218 Ack=190 Win=65535 Len=1120"
10.0.2.15,54.230.144.210,49439,80,TCP,1460611597,54.230.144.210,49439  >  http [ACK] Seq=190 Ack=45338 Win=64240 Len=0
54.230.144.210,10.0.2.15,80,49439,TCP,1460611597,10.0.2.15,http  >  49439 [ACK] Seq=45338 Ack=190 Win=65535 Len=1420
54.230.144.210,10.0.2.15,80,49439,TCP,1460611597,10.0.2.15,http  >  49439 [ACK] Seq=46758 Ack=190 Win=65535 Len=1420
54.230.144.210,10.0.2.15,80,49439,TCP,1460611597,10.0.2.15,"http  >  49439 [PSH, ACK] Seq=48178 Ack=190 Win=65535 Len=1240"
10.0.2.15,54.230.144.210,49439,80,TCP,1460611597,54.230.144.210,49439  >  http [ACK] Seq=190 Ack=49418 Win=64240 Len=0
54.230.144.210,10.0.2.15,80,49439,TCP,1460611597,10.0.2.15,http  >  49439 [ACK] Seq=49418 Ack=190 Win=65535 Len=1420
54.230.144.210,10.0.2.15,80,49439,TCP,1460611597,10.0.2.15,http  >  49439 [ACK] Seq=50838 Ack=190 Win=65535 Len=1420
54.230.144.210,10.0.2.15,80,49439,TCP,1460611597,10.0.2.15,http  >  49439 [ACK] Seq=52258 Ack=190 Win=65535 Len=1420
54.230.144.210,10.0.2.15,80,49439,TCP,1460611597,10.0.2.15,"http  >  49439 [PSH, ACK] Seq=53678 Ack=190 Win=65535 Len=1180"
10.0.2.15,54.230.144.210,49439,80,TCP,1460611597,54.230.144.210,49439  >  http [ACK] Seq=190 Ack=54858 Win=64240 Len=0
54.230.144.210,10.0.2.15,80,49439,TCP,1460611597,10.0.2.15,http  >  49439 [ACK] Seq=54858 Ack=190 Win=65535 Len=1420
54.230.144.210,10.0.2.15,80,49439,TCP,1460611597,10.0.2.15,"http  >  49439 [PSH, ACK] Seq=56278 Ack=190 Win=65535 Len=1300"
10.0.2.15,54.230.144.210,49439,80,TCP,1460611597,54.230.144.210,49439  >  http [ACK] Seq=190 Ack=57578 Win=64240 Len=0
54.230.144.210,10.0.2.15,80,49439,TCP,1460611597,10.0.2.15,http  >  49439 [ACK] Seq=57578 Ack=190 Win=65535 Len=1420
54.230.144.210,10.0.2.15,80,49439,TCP,1460611597,10.0.2.15,http  >  49439 [ACK] Seq=58998 Ack=190 Win=65535 Len=1420
54.230.144.210,10.0.2.15,80,49439,TCP,1460611597,10.0.2.15,"http  >  49439 [PSH, ACK] Seq=60418 Ack=190 Win=65535 Len=1240"
10.0.2.15,54.230.144.210,49439,80,TCP,1460611597,54.230.144.210,49439  >  http [ACK] Seq=190 Ack=61658 Win=64240 Len=0
54.230.144.210,10.0.2.15,80,49439,TCP,1460611597,10.0.2.15,http  >  49439 [ACK] Seq=61658 Ack=190 Win=65535 Len=1420
54.230.144.210,10.0.2.15,80,49439,TCP,1460611597,10.0.2.15,http  >  49439 [ACK] Seq=63078 Ack=190 Win=65535 Len=1420
54.230.144.210,10.0.2.15,80,49439,TCP,1460611597,10.0.2.15,"http  >  49439 [PSH, ACK] Seq=64498 Ack=190 Win=65535 Len=1240"
10.0.2.15,54.230.144.210,49439,80,TCP,1460611597,54.230.144.210,49439  >  http [ACK] Seq=190 Ack=65738 Win=64240 Len=0
54.230.144.210,10.0.2.15,80,49439,TCP,1460611597,10.0.2.15,http  >  49439 [ACK] Seq=65738 Ack=190 Win=65535 Len=1420
54.230.144.210,10.0.2.15,80,49439,TCP,1460611597,10.0.2.15,"http  >  49439 [PSH, ACK] Seq=67158 Ack=190 Win=65535 Len=1300"
10.0.2.15,54.230.144.210,49439,80,TCP,1460611597,54.230.144.210,49439  >  http [ACK] Seq=190 Ack=68458 Win=64240 Len=0
54.230.144.210,10.0.2.15,80,49439,TCP,1460611597,10.0.2.15,http  >  49439 [ACK] Seq=68458 Ack=190 Win=65535 Len=1420
54.230.144.210,10.0.2.15,80,49439,TCP,1460611597,10.0.2.15,"http  >  49439 [PSH, ACK] Seq=69878 Ack=190 Win=65535 Len=1300"
10.0.2.15,54.230.144.210,49439,80,TCP,1460611597,54.230.144.210,49439  >  http [ACK] Seq=190 Ack=71178 Win=64240 Len=0
54.230.144.210,10.0.2.15,80,49439,TCP,1460611597,10.0.2.15,http  >  49439 [ACK] Seq=71178 Ack=190 Win=65535 Len=1420
54.230.144.210,10.0.2.15,80,49439,TCP,1460611597,10.0.2.15,http  >  49439 [ACK] Seq=72598 Ack=190 Win=65535 Len=1420
54.230.144.210,10.0.2.15,80,49439,TCP,1460611597,10.0.2.15,http  >  49439 [ACK] Seq=74018 Ack=190 Win=65535 Len=1420
54.230.144.210,10.0.2.15,80,49439,TCP,1460611597,10.0.2.15,http  >  49439 [ACK] Seq=75438 Ack=190 Win=65535 Len=1420
54.230.144.210,10.0.2.15,80,49439,TCP,1460611597,10.0.2.15,"http  >  49439 [PSH, ACK] Seq=76858 Ack=190 Win=65535 Len=1120"
10.0.2.15,54.230.144.210,49439,80,TCP,1460611597,54.230.144.210,49439  >  http [ACK] Seq=190 Ack=77978 Win=60280 Len=0
54.230.144.210,10.0.2.15,80,49439,TCP,1460611597,10.0.2.15,http  >  49439 [ACK] Seq=77978 Ack=190 Win=65535 Len=1420
54.230.144.210,10.0.2.15,80,49439,TCP,1460611597,10.0.2.15,http  >  49439 [ACK] Seq=79398 Ack=190 Win=65535 Len=1420
54.230.144.210,10.0.2.15,80,49439,TCP,1460611597,10.0.2.15,http  >  49439 [ACK] Seq=80818 Ack=190 Win=65535 Len=1420
54.230.144.210,10.0.2.15,80,49439,TCP,1460611597,10.0.2.15,http  >  49439 [ACK] Seq=82238 Ack=190 Win=65535 Len=1420
54.230.144.210,10.0.2.15,80,49439,TCP,1460611597,10.0.2.15,http  >  49439 [ACK] Seq=83658 Ack=190 Win=65535 Len=1420
54.230.144.210,10.0.2.15,80,49439,TCP,1460611597,10.0.2.15,http  >  49439 [ACK] Seq=85078 Ack=190 Win=65535 Len=1420
54.230.144.210,10.0.2.15,80,49439,TCP,1460611597,10.0.2.15,"http  >  49439 [PSH, ACK] Seq=86498 Ack=190 Win=65535 Len=1000"
10.0.2.15,54.230.144.210,49439,80,TCP,1460611597,54.230.144.210,49439  >  http [ACK] Seq=190 Ack=87498 Win=50760 Len=0
54.230.144.210,10.0.2.15,80,49439,TCP,1460611597,10.0.2.15,http  >  49439 [ACK] Seq=87498 Ack=190 Win=65535 Len=1420
54.230.144.210,10.0.2.15,80,49439,TCP,1460611597,10.0.2.15,"http  >  49439 [PSH, ACK] Seq=88918 Ack=190 Win=65535 Len=1300"
10.0.2.15,54.230.144.210,49439,80,TCP,1460611597,54.230.144.210,49439  >  http [ACK] Seq=190 Ack=90218 Win=48040 Len=0
54.230.144.210,10.0.2.15,80,49439,TCP,1460611597,10.0.2.15,http  >  49439 [ACK] Seq=90218 Ack=190 Win=65535 Len=1420
54.230.144.210,10.0.2.15,80,49439,TCP,1460611597,10.0.2.15,http  >  49439 [ACK] Seq=91638 Ack=190 Win=65535 Len=1420
54.230.144.210,10.0.2.15,80,49439,TCP,1460611597,10.0.2.15,"http  >  49439 [PSH, ACK] Seq=93058 Ack=190 Win=65535 Len=1240"
10.0.2.15,54.230.144.210,49439,80,TCP,1460611597,54.230.144.210,49439  >  http [ACK] Seq=190 Ack=94298 Win=43960 Len=0
54.230.144.210,10.0.2.15,80,49439,TCP,1460611597,10.0.2.15,http  >  49439 [ACK] Seq=94298 Ack=190 Win=65535 Len=1420
54.230.144.210,10.0.2.15,80,49439,TCP,1460611597,10.0.2.15,http  >  49439 [ACK] Seq=95718 Ack=190 Win=65535 Len=1420
54.230.144.210,10.0.2.15,80,49439,TCP,1460611597,10.0.2.15,http  >  49439 [ACK] Seq=97138 Ack=190 Win=65535 Len=1420
54.230.144.210,10.0.2.15,80,49439,TCP,1460611597,10.0.2.15,"http  >  49439 [PSH, ACK] Seq=98558 Ack=190 Win=65535 Len=1180"
10.0.2.15,54.230.144.210,49439,80,TCP,1460611597,54.230.144.210,49439  >  http [ACK] Seq=190 Ack=99738 Win=38520 Len=0
10.0.2.15,54.230.144.210,49439,80,TCP,1460611597,54.230.144.210,[TCP Window Update] 49439  >  http [ACK] Seq=190 Ack=99738 Win=64240 Len=0
54.230.144.210,10.0.2.15,80,49439,TCP,1460611597,10.0.2.15,http  >  49439 [ACK] Seq=99738 Ack=190 Win=65535 Len=1420
54.230.144.210,10.0.2.15,80,49439,TCP,1460611597,10.0.2.15,http  >  49439 [ACK] Seq=101158 Ack=190 Win=65535 Len=1420
54.230.144.210,10.0.2.15,80,49439,TCP,1460611597,10.0.2.15,"http  >  49439 [PSH, ACK] Seq=102578 Ack=190 Win=65535 Len=1240"
54.230.144.210,10.0.2.15,80,49439,TCP,1460611597,10.0.2.15,http  >  49439 [ACK] Seq=103818 Ack=190 Win=65535 Len=1420
54.230.144.210,10.0.2.15,80,49439,TCP,1460611597,10.0.2.15,"http  >  49439 [PSH, ACK] Seq=105238 Ack=190 Win=65535 Len=1300"
10.0.2.15,54.230.144.210,49439,80,TCP,1460611597,54.230.144.210,49439  >  http [ACK] Seq=190 Ack=106538 Win=57440 Len=0
10.0.2.15,54.230.144.210,49439,80,TCP,1460611597,54.230.144.210,[TCP Window Update] 49439  >  http [ACK] Seq=190 Ack=106538 Win=64240 Len=0
54.230.144.210,10.0.2.15,80,49439,TCP,1460611597,10.0.2.15,http  >  49439 [ACK] Seq=106538 Ack=190 Win=65535 Len=1420
54.230.144.210,10.0.2.15,80,49439,TCP,1460611597,10.0.2.15,"http  >  49439 [PSH, ACK] Seq=107958 Ack=190 Win=65535 Len=1300"
54.230.144.210,10.0.2.15,80,49439,TCP,1460611597,10.0.2.15,"http  >  49439 [PSH, ACK] Seq=109258 Ack=190 Win=65535 Len=1360"
10.0.2.15,54.230.144.210,49439,80,TCP,1460611597,54.230.144.210,49439  >  http [ACK] Seq=190 Ack=110618 Win=60160 Len=0
10.0.2.15,54.230.144.210,49439,80,TCP,1460611597,54.230.144.210,[TCP Window Update] 49439  >  http [ACK] Seq=190 Ack=110618 Win=64240 Len=0
54.230.144.210,10.0.2.15,80,49439,TCP,1460611597,10.0.2.15,http  >  49439 [ACK] Seq=110618 Ack=190 Win=65535 Len=1420
54.230.144.210,10.0.2.15,80,49439,TCP,1460611597,10.0.2.15,http  >  49439 [ACK] Seq=112038 Ack=190 Win=65535 Len=1420
54.230.144.210,10.0.2.15,80,49439,TCP,1460611597,10.0.2.15,http  >  49439 [ACK] Seq=113458 Ack=190 Win=65535 Len=1420
54.230.144.210,10.0.2.15,80,49439,TCP,1460611597,10.0.2.15,http  >  49439 [ACK] Seq=114878 Ack=190 Win=65535 Len=1420
54.230.144.210,10.0.2.15,80,49439,TCP,1460611597,10.0.2.15,http  >  49439 [ACK] Seq=116298 Ack=190 Win=65535 Len=1420
54.230.144.210,10.0.2.15,80,49439,TCP,1460611597,10.0.2.15,http  >  49439 [ACK] Seq=117718 Ack=190 Win=65535 Len=1420
54.230.144.210,10.0.2.15,80,49439,TCP,1460611597,10.0.2.15,"http  >  49439 [PSH, ACK] Seq=119138 Ack=190 Win=65535 Len=1000"
10.0.2.15,54.230.144.210,49439,80,TCP,1460611597,54.230.144.210,49439  >  http [ACK] Seq=190 Ack=120138 Win=64240 Len=0
54.230.144.210,10.0.2.15,80,49439,TCP,1460611597,10.0.2.15,http  >  49439 [ACK] Seq=120138 Ack=190 Win=65535 Len=1420
54.230.144.210,10.0.2.15,80,49439,TCP,1460611597,10.0.2.15,http  >  49439 [ACK] Seq=121558 Ack=190 Win=65535 Len=1420
54.230.144.210,10.0.2.15,80,49439,TCP,1460611597,10.0.2.15,http  >  49439 [ACK] Seq=122978 Ack=190 Win=65535 Len=1420
54.230.144.210,10.0.2.15,80,49439,TCP,1460611597,10.0.2.15,"http  >  49439 [PSH, ACK] Seq=124398 Ack=190 Win=65535 Len=1180"
10.0.2.15,54.230.144.210,49439,80,TCP,1460611597,54.230.144.210,49439  >  http [ACK] Seq=190 Ack=125578 Win=64240 Len=0
54.230.144.210,10.0.2.15,80,49439,TCP,1460611597,10.0.2.15,http  >  49439 [ACK] Seq=125578 Ack=190 Win=65535 Len=1420
54.230.144.210,10.0.2.15,80,49439,TCP,1460611597,10.0.2.15,http  >  49439 [ACK] Seq=126998 Ack=190 Win=65535 Len=1420
54.230.144.210,10.0.2.15,80,49439,TCP,1460611597,10.0.2.15,http  >  49439 [ACK] Seq=128418 Ack=190 Win=65535 Len=1420
54.230.144.210,10.0.2.15,80,49439,TCP,1460611597,10.0.2.15,http  >  49439 [ACK] Seq=129838 Ack=190 Win=65535 Len=1420
54.230.144.210,10.0.2.15,80,49439,TCP,1460611597,10.0.2.15,http  >  49439 [ACK] Seq=131258 Ack=190 Win=65535 Len=1420
54.230.144.210,10.0.2.15,80,49439,TCP,1460611597,10.0.2.15,"http  >  49439 [PSH, ACK] Seq=132678 Ack=190 Win=65535 Len=1060"
10.0.2.15,54.230.144.210,49439,80,TCP,1460611597,54.230.144.210,49439  >  http [ACK] Seq=190 Ack=133738 Win=64240 Len=0
54.230.144.210,10.0.2.15,80,49439,TCP,1460611597,10.0.2.15,http  >  49439 [ACK] Seq=133738 Ack=190 Win=65535 Len=1420
54.230.144.210,10.0.2.15,80,49439,TCP,1460611597,10.0.2.15,http  >  49439 [ACK] Seq=135158 Ack=190 Win=65535 Len=1420
54.230.144.210,10.0.2.15,80,49439,TCP,1460611597,10.0.2.15,"http  >  49439 [PSH, ACK] Seq=136578 Ack=190 Win=65535 Len=1240"
54.230.144.210,10.0.2.15,80,49439,TCP,1460611597,10.0.2.15,http  >  49439 [ACK] Seq=137818 Ack=190 Win=65535 Len=1420
54.230.144.210,10.0.2.15,80,49439,TCP,1460611597,10.0.2.15,http  >  49439 [ACK] Seq=139238 Ack=190 Win=65535 Len=1420
54.230.144.210,10.0.2.15,80,49439,TCP,1460611597,10.0.2.15,http  >  49439 [ACK] Seq=140658 Ack=190 Win=65535 Len=1420
54.230.144.210,10.0.2.15,80,49439,TCP,1460611597,10.0.2.15,http  >  49439 [ACK] Seq=142078 Ack=190 Win=65535 Len=1420
54.230.144.210,10.0.2.15,80,49439,TCP,1460611597,10.0.2.15,http  >  49439 [ACK] Seq=143498 Ack=190 Win=65535 Len=1420
54.230.144.210,10.0.2.15,80,49439,TCP,1460611597,10.0.2.15,"http  >  49439 [PSH, ACK] Seq=144918 Ack=190 Win=65535 Len=1060"
10.0.2.15,54.230.144.210,49439,80,TCP,1460611597,54.230.144.210,49439  >  http [ACK] Seq=190 Ack=145978 Win=64240 Len=0
54.230.144.210,10.0.2.15,80,49439,TCP,1460611597,10.0.2.15,http  >  49439 [ACK] Seq=145978 Ack=190 Win=65535 Len=1420
54.230.144.210,10.0.2.15,80,49439,TCP,1460611597,10.0.2.15,http  >  49439 [ACK] Seq=147398 Ack=190 Win=65535 Len=1420
54.230.144.210,10.0.2.15,80,49439,TCP,1460611597,10.0.2.15,http  >  49439 [ACK] Seq=148818 Ack=190 Win=65535 Len=1420
54.230.144.210,10.0.2.15,80,49439,TCP,1460611597,10.0.2.15,http  >  49439 [ACK] Seq=150238 Ack=190 Win=65535 Len=1420
54.230.144.210,10.0.2.15,80,49439,TCP,1460611597,10.0.2.15,http  >  49439 [ACK] Seq=151658 Ack=190 Win=65535 Len=1420
54.230.144.210,10.0.2.15,80,49439,TCP,1460611597,10.0.2.15,http  >  49439 [ACK] Seq=153078 Ack=190 Win=65535 Len=1420
54.230.144.210,10.0.2.15,80,49439,TCP,1460611597,10.0.2.15,"http  >  49439 [PSH, ACK] Seq=154498 Ack=190 Win=65535 Len=1000"
54.230.144.210,10.0.2.15,80,49439,TCP,1460611597,10.0.2.15,http  >  49439 [ACK] Seq=155498 Ack=190 Win=65535 Len=1420
54.230.144.210,10.0.2.15,80,49439,TCP,1460611597,10.0.2.15,http  >  49439 [ACK] Seq=156918 Ack=190 Win=65535 Len=1420
54.230.144.210,10.0.2.15,80,49439,TCP,1460611597,10.0.2.15,"http  >  49439 [PSH, ACK] Seq=158338 Ack=190 Win=65535 Len=1240"
10.0.2.15,54.230.144.210,49439,80,TCP,1460611597,54.230.144.210,49439  >  http [ACK] Seq=190 Ack=159578 Win=64240 Len=0
54.230.144.210,10.0.2.15,80,49439,TCP,1460611597,10.0.2.15,http  >  49439 [ACK] Seq=159578 Ack=190 Win=65535 Len=1420
54.230.144.210,10.0.2.15,80,49439,TCP,1460611597,10.0.2.15,http  >  49439 [ACK] Seq=160998 Ack=190 Win=65535 Len=1420
54.230.144.210,10.0.2.15,80,49439,TCP,1460611597,10.0.2.15,"http  >  49439 [PSH, ACK] Seq=162418 Ack=190 Win=65535 Len=1240"
10.0.2.15,54.230.144.210,49439,80,TCP,1460611597,54.230.144.210,49439  >  http [ACK] Seq=190 Ack=163658 Win=64240 Len=0
54.230.144.210,10.0.2.15,80,49439,TCP,1460611597,10.0.2.15,http  >  49439 [ACK] Seq=163658 Ack=190 Win=65535 Len=1420
54.230.144.210,10.0.2.15,80,49439,TCP,1460611597,10.0.2.15,http  >  49439 [ACK] Seq=165078 Ack=190 Win=65535 Len=1420
54.230.144.210,10.0.2.15,80,49439,TCP,1460611597,10.0.2.15,http  >  49439 [ACK] Seq=166498 Ack=190 Win=65535 Len=1420
54.230.144.210,10.0.2.15,80,49439,TCP,1460611597,10.0.2.15,http  >  49439 [ACK] Seq=167918 Ack=190 Win=65535 Len=1420
54.230.144.210,10.0.2.15,80,49439,TCP,1460611597,10.0.2.15,http  >  49439 [ACK] Seq=169338 Ack=190 Win=65535 Len=1420
54.230.144.210,10.0.2.15,80,49439,TCP,1460611597,10.0.2.15,http  >  49439 [ACK] Seq=170758 Ack=190 Win=65535 Len=1420
54.230.144.210,10.0.2.15,80,49439,TCP,1460611597,10.0.2.15,"http  >  49439 [PSH, ACK] Seq=172178 Ack=190 Win=65535 Len=1000"
10.0.2.15,54.230.144.210,49439,80,TCP,1460611597,54.230.144.210,49439  >  http [ACK] Seq=190 Ack=173178 Win=64240 Len=0
54.230.144.210,10.0.2.15,80,49439,TCP,1460611597,10.0.2.15,http  >  49439 [ACK] Seq=173178 Ack=190 Win=65535 Len=1420
54.230.144.210,10.0.2.15,80,49439,TCP,1460611597,10.0.2.15,http  >  49439 [ACK] Seq=174598 Ack=190 Win=65535 Len=1420
54.230.144.210,10.0.2.15,80,49439,TCP,1460611597,10.0.2.15,http  >  49439 [ACK] Seq=176018 Ack=190 Win=65535 Len=1420
54.230.144.210,10.0.2.15,80,49439,TCP,1460611597,10.0.2.15,http  >  49439 [ACK] Seq=177438 Ack=190 Win=65535 Len=1420
54.230.144.210,10.0.2.15,80,49439,TCP,1460611597,10.0.2.15,http  >  49439 [ACK] Seq=178858 Ack=190 Win=65535 Len=1420
54.230.144.210,10.0.2.15,80,49439,TCP,1460611597,10.0.2.15,http  >  49439 [ACK] Seq=180278 Ack=190 Win=65535 Len=1420
54.230.144.210,10.0.2.15,80,49439,TCP,1460611597,10.0.2.15,"http  >  49439 [PSH, ACK] Seq=181698 Ack=190 Win=65535 Len=1000"
54.230.144.210,10.0.2.15,80,49439,TCP,1460611597,10.0.2.15,http  >  49439 [ACK] Seq=182698 Ack=190 Win=65535 Len=1420
54.230.144.210,10.0.2.15,80,49439,TCP,1460611597,10.0.2.15,http  >  49439 [ACK] Seq=184118 Ack=190 Win=65535 Len=1420
54.230.144.210,10.0.2.15,80,49439,TCP,1460611597,10.0.2.15,http  >  49439 [ACK] Seq=185538 Ack=190 Win=65535 Len=1420
54.230.144.210,10.0.2.15,80,49439,TCP,1460611597,10.0.2.15,http  >  49439 [ACK] Seq=186958 Ack=190 Win=65535 Len=1420
54.230.144.210,10.0.2.15,80,49439,TCP,1460611597,10.0.2.15,http  >  49439 [ACK] Seq=188378 Ack=190 Win=65535 Len=1420
54.230.144.210,10.0.2.15,80,49439,TCP,1460611597,10.0.2.15,"http  >  49439 [PSH, ACK] Seq=189798 Ack=190 Win=65535 Len=1060"
10.0.2.15,54.230.144.210,49439,80,TCP,1460611597,54.230.144.210,49439  >  http [ACK] Seq=190 Ack=190858 Win=63180 Len=0
54.230.144.210,10.0.2.15,80,49439,TCP,1460611597,10.0.2.15,http  >  49439 [ACK] Seq=190858 Ack=190 Win=65535 Len=1420
54.230.144.210,10.0.2.15,80,49439,TCP,1460611597,10.0.2.15,http  >  49439 [ACK] Seq=192278 Ack=190 Win=65535 Len=1420
54.230.144.210,10.0.2.15,80,49439,TCP,1460611597,10.0.2.15,http  >  49439 [ACK] Seq=193698 Ack=190 Win=65535 Len=1420
54.230.144.210,10.0.2.15,80,49439,TCP,1460611597,10.0.2.15,http  >  49439 [ACK] Seq=195118 Ack=190 Win=65535 Len=1420
54.230.144.210,10.0.2.15,80,49439,TCP,1460611597,10.0.2.15,http  >  49439 [ACK] Seq=196538 Ack=190 Win=65535 Len=1420
54.230.144.210,10.0.2.15,80,49439,TCP,1460611597,10.0.2.15,http  >  49439 [ACK] Seq=197958 Ack=190 Win=65535 Len=1420
54.230.144.210,10.0.2.15,80,49439,TCP,1460611597,10.0.2.15,http  >  49439 [ACK] Seq=199378 Ack=190 Win=65535 Len=1420
54.230.144.210,10.0.2.15,80,49439,TCP,1460611597,10.0.2.15,http  >  49439 [ACK] Seq=200798 Ack=190 Win=65535 Len=1420
54.230.144.210,10.0.2.15,80,49439,TCP,1460611597,10.0.2.15,http  >  49439 [ACK] Seq=202218 Ack=190 Win=65535 Len=1420
54.230.144.210,10.0.2.15,80,49439,TCP,1460611597,10.0.2.15,"http  >  49439 [PSH, ACK] Seq=203638 Ack=190 Win=65535 Len=820"
10.0.2.15,54.230.144.210,49439,80,TCP,1460611597,54.230.144.210,49439  >  http [ACK] Seq=190 Ack=204458 Win=64240 Len=0
54.230.144.210,10.0.2.15,80,49439,TCP,1460611597,10.0.2.15,http  >  49439 [ACK] Seq=204458 Ack=190 Win=65535 Len=1420
54.230.144.210,10.0.2.15,80,49439,TCP,1460611597,10.0.2.15,http  >  49439 [ACK] Seq=205878 Ack=190 Win=65535 Len=1420
54.230.144.210,10.0.2.15,80,49439,TCP,1460611597,10.0.2.15,"http  >  49439 [PSH, ACK] Seq=207298 Ack=190 Win=65535 Len=1240"
10.0.2.15,54.230.144.210,49439,80,TCP,1460611597,54.230.144.210,49439  >  http [ACK] Seq=190 Ack=208538 Win=64240 Len=0
54.230.144.210,10.0.2.15,80,49439,TCP,1460611597,10.0.2.15,"http  >  49439 [PSH, ACK] Seq=208538 Ack=190 Win=65535 Len=1360"
54.230.144.210,10.0.2.15,80,49439,TCP,1460611597,10.0.2.15,http  >  49439 [ACK] Seq=209898 Ack=190 Win=65535 Len=1420
54.230.144.210,10.0.2.15,80,49439,TCP,1460611597,10.0.2.15,"http  >  49439 [PSH, ACK] Seq=211318 Ack=190 Win=65535 Len=1300"
10.0.2.15,54.230.144.210,49439,80,TCP,1460611597,54.230.144.210,49439  >  http [ACK] Seq=190 Ack=212618 Win=64240 Len=0
54.230.144.210,10.0.2.15,80,49439,TCP,1460611597,10.0.2.15,http  >  49439 [ACK] Seq=212618 Ack=190 Win=65535 Len=1420
54.230.144.210,10.0.2.15,80,49439,TCP,1460611597,10.0.2.15,http  >  49439 [ACK] Seq=214038 Ack=190 Win=65535 Len=1420
54.230.144.210,10.0.2.15,80,49439,TCP,1460611597,10.0.2.15,http  >  49439 [ACK] Seq=215458 Ack=190 Win=65535 Len=1420
54.230.144.210,10.0.2.15,80,49439,TCP,1460611597,10.0.2.15,http  >  49439 [ACK] Seq=216878 Ack=190 Win=65535 Len=1420
54.230.144.210,10.0.2.15,80,49439,TCP,1460611597,10.0.2.15,http  >  49439 [ACK] Seq=218298 Ack=190 Win=65535 Len=1420
54.230.144.210,10.0.2.15,80,49439,TCP,1460611597,10.0.2.15,http  >  49439 [ACK] Seq=219718 Ack=190 Win=65535 Len=1420
54.230.144.210,10.0.2.15,80,49439,TCP,1460611597,10.0.2.15,"http  >  49439 [PSH, ACK] Seq=221138 Ack=190 Win=65535 Len=1000"
10.0.2.15,54.230.144.210,49439,80,TCP,1460611597,54.230.144.210,49439  >  http [ACK] Seq=190 Ack=222138 Win=60400 Len=0
10.0.2.15,54.230.144.210,49439,80,TCP,1460611597,54.230.144.210,[TCP Window Update] 49439  >  http [ACK] Seq=190 Ack=222138 Win=64240 Len=0
54.230.144.210,10.0.2.15,80,49439,TCP,1460611597,10.0.2.15,http  >  49439 [ACK] Seq=222138 Ack=190 Win=65535 Len=1420
54.230.144.210,10.0.2.15,80,49439,TCP,1460611597,10.0.2.15,http  >  49439 [ACK] Seq=223558 Ack=190 Win=65535 Len=1420
54.230.144.210,10.0.2.15,80,49439,TCP,1460611597,10.0.2.15,http  >  49439 [ACK] Seq=224978 Ack=190 Win=65535 Len=1420
54.230.144.210,10.0.2.15,80,49439,TCP,1460611597,10.0.2.15,http  >  49439 [ACK] Seq=226398 Ack=190 Win=65535 Len=1420
54.230.144.210,10.0.2.15,80,49439,TCP,1460611597,10.0.2.15,http  >  49439 [ACK] Seq=227818 Ack=190 Win=65535 Len=1420
54.230.144.210,10.0.2.15,80,49439,TCP,1460611597,10.0.2.15,http  >  49439 [ACK] Seq=229238 Ack=190 Win=65535 Len=1420
54.230.144.210,10.0.2.15,80,49439,TCP,1460611597,10.0.2.15,"http  >  49439 [PSH, ACK] Seq=230658 Ack=190 Win=65535 Len=1000"
54.230.144.210,10.0.2.15,80,49439,TCP,1460611597,10.0.2.15,http  >  49439 [ACK] Seq=231658 Ack=190 Win=65535 Len=1420
54.230.144.210,10.0.2.15,80,49439,TCP,1460611597,10.0.2.15,http  >  49439 [ACK] Seq=233078 Ack=190 Win=65535 Len=1420
54.230.144.210,10.0.2.15,80,49439,TCP,1460611597,10.0.2.15,http  >  49439 [ACK] Seq=234498 Ack=190 Win=65535 Len=1420
54.230.144.210,10.0.2.15,80,49439,TCP,1460611597,10.0.2.15,http  >  49439 [ACK] Seq=235918 Ack=190 Win=65535 Len=1420
54.230.144.210,10.0.2.15,80,49439,TCP,1460611597,10.0.2.15,http  >  49439 [ACK] Seq=237338 Ack=190 Win=65535 Len=1420
54.230.144.210,10.0.2.15,80,49439,TCP,1460611597,10.0.2.15,http  >  49439 [ACK] Seq=238758 Ack=190 Win=65535 Len=1420
54.230.144.210,10.0.2.15,80,49439,TCP,1460611597,10.0.2.15,"http  >  49439 [PSH, ACK] Seq=240178 Ack=190 Win=65535 Len=1000"
10.0.2.15,54.230.144.210,49439,80,TCP,1460611597,54.230.144.210,49439  >  http [ACK] Seq=190 Ack=241178 Win=61820 Len=0
10.0.2.15,54.230.144.210,49439,80,TCP,1460611597,54.230.144.210,[TCP Window Update] 49439  >  http [ACK] Seq=190 Ack=241178 Win=64240 Len=0
54.230.144.210,10.0.2.15,80,49439,TCP,1460611597,10.0.2.15,"http  >  49439 [PSH, ACK] Seq=241178 Ack=190 Win=65535 Len=1360"
54.230.144.210,10.0.2.15,80,49439,TCP,1460611597,10.0.2.15,http  >  49439 [ACK] Seq=242538 Ack=190 Win=65535 Len=1420
54.230.144.210,10.0.2.15,80,49439,TCP,1460611597,10.0.2.15,http  >  49439 [ACK] Seq=243958 Ack=190 Win=65535 Len=1420
54.230.144.210,10.0.2.15,80,49439,TCP,1460611597,10.0.2.15,http  >  49439 [ACK] Seq=245378 Ack=190 Win=65535 Len=1420
54.230.144.210,10.0.2.15,80,49439,TCP,1460611597,10.0.2.15,http  >  49439 [ACK] Seq=246798 Ack=190 Win=65535 Len=1420
54.230.144.210,10.0.2.15,80,49439,TCP,1460611597,10.0.2.15,http  >  49439 [ACK] Seq=248218 Ack=190 Win=65535 Len=1420
54.230.144.210,10.0.2.15,80,49439,TCP,1460611597,10.0.2.15,http  >  49439 [ACK] Seq=249638 Ack=190 Win=65535 Len=1420
54.230.144.210,10.0.2.15,80,49439,TCP,1460611597,10.0.2.15,"http  >  49439 [PSH, ACK] Seq=251058 Ack=190 Win=65535 Len=1000"
54.230.144.210,10.0.2.15,80,49439,TCP,1460611597,10.0.2.15,http  >  49439 [ACK] Seq=252058 Ack=190 Win=65535 Len=1420
54.230.144.210,10.0.2.15,80,49439,TCP,1460611597,10.0.2.15,http  >  49439 [ACK] Seq=253478 Ack=190 Win=65535 Len=1420
54.230.144.210,10.0.2.15,80,49439,TCP,1460611597,10.0.2.15,http  >  49439 [ACK] Seq=254898 Ack=190 Win=65535 Len=1420
54.230.144.210,10.0.2.15,80,49439,TCP,1460611597,10.0.2.15,http  >  49439 [ACK] Seq=256318 Ack=190 Win=65535 Len=1420
54.230.144.210,10.0.2.15,80,49439,TCP,1460611597,10.0.2.15,http  >  49439 [ACK] Seq=257738 Ack=190 Win=65535 Len=1420
54.230.144.210,10.0.2.15,80,49439,TCP,1460611597,10.0.2.15,http  >  49439 [ACK] Seq=259158 Ack=190 Win=65535 Len=1420
54.230.144.210,10.0.2.15,80,49439,TCP,1460611597,10.0.2.15,"http  >  49439 [PSH, ACK] Seq=260578 Ack=190 Win=65535 Len=1000"
10.0.2.15,54.230.144.210,49439,80,TCP,1460611597,54.230.144.210,49439  >  http [ACK] Seq=190 Ack=261578 Win=61820 Len=0
54.230.144.210,10.0.2.15,80,49439,TCP,1460611597,10.0.2.15,http  >  49439 [ACK] Seq=261578 Ack=190 Win=65535 Len=1420
54.230.144.210,10.0.2.15,80,49439,TCP,1460611597,10.0.2.15,http  >  49439 [ACK] Seq=262998 Ack=190 Win=65535 Len=1420
54.230.144.210,10.0.2.15,80,49439,TCP,1460611597,10.0.2.15,http  >  49439 [ACK] Seq=264418 Ack=190 Win=65535 Len=1420
54.230.144.210,10.0.2.15,80,49439,TCP,1460611597,10.0.2.15,http  >  49439 [ACK] Seq=265838 Ack=190 Win=65535 Len=1420
54.230.144.210,10.0.2.15,80,49439,TCP,1460611597,10.0.2.15,http  >  49439 [ACK] Seq=267258 Ack=190 Win=65535 Len=1420
54.230.144.210,10.0.2.15,80,49439,TCP,1460611597,10.0.2.15,http  >  49439 [ACK] Seq=268678 Ack=190 Win=65535 Len=1420
54.230.144.210,10.0.2.15,80,49439,TCP,1460611597,10.0.2.15,"http  >  49439 [PSH, ACK] Seq=270098 Ack=190 Win=65535 Len=1000"
10.0.2.15,54.230.144.210,49439,80,TCP,1460611597,54.230.144.210,49439  >  http [ACK] Seq=190 Ack=271098 Win=52300 Len=0
10.0.2.15,54.230.144.210,49439,80,TCP,1460611597,54.230.144.210,[TCP Window Update] 49439  >  http [ACK] Seq=190 Ack=271098 Win=64240 Len=0
54.230.144.210,10.0.2.15,80,49439,TCP,1460611597,10.0.2.15,http  >  49439 [ACK] Seq=271098 Ack=190 Win=65535 Len=1420
54.230.144.210,10.0.2.15,80,49439,TCP,1460611597,10.0.2.15,"http  >  49439 [PSH, ACK] Seq=272518 Ack=190 Win=65535 Len=1300"
10.0.2.15,54.230.144.210,49439,80,TCP,1460611597,54.230.144.210,49439  >  http [ACK] Seq=190 Ack=273818 Win=64240 Len=0
54.230.144.210,10.0.2.15,80,49439,TCP,1460611597,10.0.2.15,http  >  49439 [ACK] Seq=273818 Ack=190 Win=65535 Len=1420
54.230.144.210,10.0.2.15,80,49439,TCP,1460611597,10.0.2.15,http  >  49439 [ACK] Seq=275238 Ack=190 Win=65535 Len=1420
54.230.144.210,10.0.2.15,80,49439,TCP,1460611597,10.0.2.15,http  >  49439 [ACK] Seq=276658 Ack=190 Win=65535 Len=1420
54.230.144.210,10.0.2.15,80,49439,TCP,1460611597,10.0.2.15,http  >  49439 [ACK] Seq=278078 Ack=190 Win=65535 Len=1420
54.230.144.210,10.0.2.15,80,49439,TCP,1460611597,10.0.2.15,http  >  49439 [ACK] Seq=279498 Ack=190 Win=65535 Len=1420
54.230.144.210,10.0.2.15,80,49439,TCP,1460611597,10.0.2.15,http  >  49439 [ACK] Seq=280918 Ack=190 Win=65535 Len=1420
54.230.144.210,10.0.2.15,80,49439,TCP,1460611597,10.0.2.15,"http  >  49439 [PSH, ACK] Seq=282338 Ack=190 Win=65535 Len=1000"
10.0.2.15,54.230.144.210,49439,80,TCP,1460611597,54.230.144.210,49439  >  http [ACK] Seq=190 Ack=283338 Win=64240 Len=0
54.230.144.210,10.0.2.15,80,49439,TCP,1460611597,10.0.2.15,http  >  49439 [ACK] Seq=283338 Ack=190 Win=65535 Len=1420
54.230.144.210,10.0.2.15,80,49439,TCP,1460611597,10.0.2.15,http  >  49439 [ACK] Seq=284758 Ack=190 Win=65535 Len=1420
54.230.144.210,10.0.2.15,80,49439,TCP,1460611597,10.0.2.15,http  >  49439 [ACK] Seq=286178 Ack=190 Win=65535 Len=1420
54.230.144.210,10.0.2.15,80,49439,TCP,1460611597,10.0.2.15,http  >  49439 [ACK] Seq=287598 Ack=190 Win=65535 Len=1420
54.230.144.210,10.0.2.15,80,49439,TCP,1460611597,10.0.2.15,http  >  49439 [ACK] Seq=289018 Ack=190 Win=65535 Len=1420
54.230.144.210,10.0.2.15,80,49439,TCP,1460611597,10.0.2.15,"http  >  49439 [PSH, ACK] Seq=290438 Ack=190 Win=65535 Len=1060"
10.0.2.15,54.230.144.210,49439,80,TCP,1460611597,54.230.144.210,49439  >  http [ACK] Seq=190 Ack=291498 Win=63180 Len=0
54.230.144.210,10.0.2.15,80,49439,TCP,1460611597,10.0.2.15,http  >  49439 [ACK] Seq=291498 Ack=190 Win=65535 Len=1420
54.230.144.210,10.0.2.15,80,49439,TCP,1460611597,10.0.2.15,http  >  49439 [ACK] Seq=292918 Ack=190 Win=65535 Len=1420
54.230.144.210,10.0.2.15,80,49439,TCP,1460611597,10.0.2.15,http  >  49439 [ACK] Seq=294338 Ack=190 Win=65535 Len=1420
54.230.144.210,10.0.2.15,80,49439,TCP,1460611597,10.0.2.15,http  >  49439 [ACK] Seq=295758 Ack=190 Win=65535 Len=1420
54.230.144.210,10.0.2.15,80,49439,TCP,1460611597,10.0.2.15,http  >  49439 [ACK] Seq=297178 Ack=190 Win=65535 Len=1420
54.230.144.210,10.0.2.15,80,49439,TCP,1460611597,10.0.2.15,http  >  49439 [ACK] Seq=298598 Ack=190 Win=65535 Len=1420
54.230.144.210,10.0.2.15,80,49439,TCP,1460611597,10.0.2.15,"http  >  49439 [PSH, ACK] Seq=300018 Ack=190 Win=65535 Len=1000"
54.230.144.210,10.0.2.15,80,49439,TCP,1460611597,10.0.2.15,http  >  49439 [ACK] Seq=301018 Ack=190 Win=65535 Len=1420
54.230.144.210,10.0.2.15,80,49439,TCP,1460611597,10.0.2.15,http  >  49439 [ACK] Seq=302438 Ack=190 Win=65535 Len=1420
54.230.144.210,10.0.2.15,80,49439,TCP,1460611597,10.0.2.15,http  >  49439 [ACK] Seq=303858 Ack=190 Win=65535 Len=1420
54.230.144.210,10.0.2.15,80,49439,TCP,1460611597,10.0.2.15,"http  >  49439 [PSH, ACK] Seq=305278 Ack=190 Win=65535 Len=1180"
10.0.2.15,54.230.144.210,49439,80,TCP,1460611597,54.230.144.210,49439  >  http [ACK] Seq=190 Ack=306458 Win=64240 Len=0
54.230.144.210,10.0.2.15,80,49439,TCP,1460611597,10.0.2.15,http  >  49439 [ACK] Seq=306458 Ack=190 Win=65535 Len=1420
54.230.144.210,10.0.2.15,80,49439,TCP,1460611597,10.0.2.15,http  >  49439 [ACK] Seq=307878 Ack=190 Win=65535 Len=1420
54.230.144.210,10.0.2.15,80,49439,TCP,1460611597,10.0.2.15,http  >  49439 [ACK] Seq=309298 Ack=190 Win=65535 Len=1420
54.230.144.210,10.0.2.15,80,49439,TCP,1460611597,10.0.2.15,http  >  49439 [ACK] Seq=310718 Ack=190 Win=65535 Len=1420
54.230.144.210,10.0.2.15,80,49439,TCP,1460611597,10.0.2.15,http  >  49439 [ACK] Seq=312138 Ack=190 Win=65535 Len=1420
54.230.144.210,10.0.2.15,80,49439,TCP,1460611597,10.0.2.15,[TCP segment of a reassembled PDU]
54.230.144.210,10.0.2.15,80,49439,TCP,1460611597,10.0.2.15,[TCP segment of a reassembled PDU]
10.0.2.15,54.230.144.210,49439,80,TCP,1460611597,54.230.144.210,49439  >  http [ACK] Seq=190 Ack=315978 Win=64240 Len=0
54.230.144.210,10.0.2.15,80,49439,TCP,1460611597,10.0.2.15,[TCP segment of a reassembled PDU]
54.230.144.210,10.0.2.15,80,49439,TCP,1460611597,10.0.2.15,http  >  49439 [ACK] Seq=317398 Ack=190 Win=65535 Len=1420
54.230.144.210,10.0.2.15,80,49439,TCP,1460611597,10.0.2.15,http  >  49439 [ACK] Seq=318818 Ack=190 Win=65535 Len=1420
54.230.144.210,10.0.2.15,80,49439,TCP,1460611597,10.0.2.15,http  >  49439 [ACK] Seq=320238 Ack=190 Win=65535 Len=1420
54.230.144.210,10.0.2.15,80,49439,TCP,1460611597,10.0.2.15,http  >  49439 [ACK] Seq=321658 Ack=190 Win=65535 Len=1420
54.230.144.210,10.0.2.15,80,49439,TCP,1460611597,10.0.2.15,http  >  49439 [ACK] Seq=323078 Ack=190 Win=65535 Len=1420
54.230.144.210,10.0.2.15,80,49439,TCP,1460611597,10.0.2.15,http  >  49439 [ACK] Seq=324498 Ack=190 Win=65535 Len=1420
54.230.144.210,10.0.2.15,80,49439,TCP,1460611597,10.0.2.15,http  >  49439 [ACK] Seq=325918 Ack=190 Win=65535 Len=1420
54.230.144.210,10.0.2.15,80,49439,TCP,1460611597,10.0.2.15,http  >  49439 [ACK] Seq=327338 Ack=190 Win=65535 Len=1420
54.230.144.210,10.0.2.15,80,49439,TCP,1460611597,10.0.2.15,http  >  49439 [ACK] Seq=328758 Ack=190 Win=65535 Len=1420
54.230.144.210,10.0.2.15,80,49439,TCP,1460611597,10.0.2.15,http  >  49439 [ACK] Seq=330178 Ack=190 Win=65535 Len=1420
54.230.144.210,10.0.2.15,80,49439,TCP,1460611597,10.0.2.15,http  >  49439 [ACK] Seq=331598 Ack=190 Win=65535 Len=1420
54.230.144.210,10.0.2.15,80,49439,TCP,1460611597,10.0.2.15,http  >  49439 [ACK] Seq=333018 Ack=190 Win=65535 Len=1420
54.230.144.210,10.0.2.15,80,49439,TCP,1460611597,10.0.2.15,http  >  49439 [ACK] Seq=334438 Ack=190 Win=65535 Len=1420
54.230.144.210,10.0.2.15,80,49439,TCP,1460611597,10.0.2.15,"http  >  49439 [PSH, ACK] Seq=335858 Ack=190 Win=65535 Len=520"
10.0.2.15,54.230.144.210,49439,80,TCP,1460611597,54.230.144.210,49439  >  http [ACK] Seq=190 Ack=336378 Win=50940 Len=0
10.0.2.15,54.230.144.210,49439,80,TCP,1460611597,54.230.144.210,[TCP Window Update] 49439  >  http [ACK] Seq=190 Ack=336378 Win=64240 Len=0
54.230.144.210,10.0.2.15,80,49439,TCP,1460611597,10.0.2.15,http  >  49439 [ACK] Seq=336378 Ack=190 Win=65535 Len=1420
54.230.144.210,10.0.2.15,80,49439,TCP,1460611597,10.0.2.15,"http  >  49439 [PSH, ACK] Seq=337798 Ack=190 Win=65535 Len=1300"
10.0.2.15,54.230.144.210,49439,80,TCP,1460611597,54.230.144.210,49439  >  http [ACK] Seq=190 Ack=339098 Win=64240 Len=0
54.230.144.210,10.0.2.15,80,49439,TCP,1460611597,10.0.2.15,http  >  49439 [ACK] Seq=339098 Ack=190 Win=65535 Len=1420
54.230.144.210,10.0.2.15,80,49439,TCP,1460611597,10.0.2.15,http  >  49439 [ACK] Seq=340518 Ack=190 Win=65535 Len=1420
54.230.144.210,10.0.2.15,80,49439,TCP,1460611597,10.0.2.15,http  >  49439 [ACK] Seq=341938 Ack=190 Win=65535 Len=1420
54.230.144.210,10.0.2.15,80,49439,TCP,1460611597,10.0.2.15,http  >  49439 [ACK] Seq=343358 Ack=190 Win=65535 Len=1420
54.230.144.210,10.0.2.15,80,49439,TCP,1460611597,10.0.2.15,http  >  49439 [ACK] Seq=344778 Ack=190 Win=65535 Len=1420
54.230.144.210,10.0.2.15,80,49439,TCP,1460611597,10.0.2.15,http  >  49439 [ACK] Seq=346198 Ack=190 Win=65535 Len=1420
54.230.144.210,10.0.2.15,80,49439,TCP,1460611597,10.0.2.15,"http  >  49439 [PSH, ACK] Seq=347618 Ack=190 Win=65535 Len=1000"
10.0.2.15,54.230.144.210,49439,80,TCP,1460611597,54.230.144.210,49439  >  http [ACK] Seq=190 Ack=348618 Win=64240 Len=0
54.230.144.210,10.0.2.15,80,49439,TCP,1460611597,10.0.2.15,http  >  49439 [ACK] Seq=348618 Ack=190 Win=65535 Len=1420
54.230.144.210,10.0.2.15,80,49439,TCP,1460611597,10.0.2.15,http  >  49439 [ACK] Seq=350038 Ack=190 Win=65535 Len=1420
54.230.144.210,10.0.2.15,80,49439,TCP,1460611597,10.0.2.15,http  >  49439 [ACK] Seq=351458 Ack=190 Win=65535 Len=1420
54.230.144.210,10.0.2.15,80,49439,TCP,1460611597,10.0.2.15,http  >  49439 [ACK] Seq=352878 Ack=190 Win=65535 Len=1420
54.230.144.210,10.0.2.15,80,49439,TCP,1460611597,10.0.2.15,http  >  49439 [ACK] Seq=354298 Ack=190 Win=65535 Len=1420
